{"$id":"index.schema.json","$schema":"https://json-schema.org/draft/2020-12/schema","additionalProperties":true,"description":"Entry-point index for the dbdocs static REST API. Lists every node stub and surface-level metadata for a generated documentation site.","properties":{"$schema":{"description":"Relative path to this document's JSON Schema.","type":"string"},"counts":{"additionalProperties":{"type":"integer"},"description":"Count of every dbt resource type present in the project, keyed by resource type name (e.g. 'model', 'source', 'test').","type":"object"},"generated_at":{"description":"ISO-8601 timestamp of when the site was generated.","type":"string"},"metadata":{"additionalProperties":true,"description":"Site-level metadata copied from dbdocs.yml plus adapter/dialect/erd_algo resolved at generate time.","type":"object"},"nodes":{"description":"One stub per node in the project. Each stub holds enough data to render a search result or nav entry; follow node_url for the full record.","items":{"additionalProperties":true,"properties":{"database":{"description":"Warehouse database the node lives in.","type":"string"},"description":{"description":"YAML docstring for this node.","type":"string"},"id":{"description":"The dbt unique_id (e.g. 'model.jaffle_shop.orders').","type":"string"},"label":{"description":"Display label (alias or name).","type":"string"},"name":{"description":"Short model/source name.","type":"string"},"node_url":{"description":"Relative URL to the full per-node JSON file.","type":"string"},"resource_type":{"description":"dbt resource type (model, source, seed, \u2026).","type":"string"},"schema":{"description":"Warehouse schema the node lives in.","type":"string"}},"required":["id","resource_type","node_url"],"type":"object"},"type":"array"}},"required":["$schema","metadata","counts","generated_at","nodes"],"title":"dbdocs api/v1/index.json","type":"object"}