{"$schema":"schema/index.schema.json","counts":{"metric":19,"model":15,"saved_query":3,"seed":6,"semantic_model":6,"source":6,"test":29,"unit_test":3},"generated_at":"2026-06-26 13:24:52","metadata":{"about_links":[{"href":"https://github.com/sponsors/datnguye","label":"Sponsor \u2665"},{"href":"https://www.linkedin.com/in/datnguye/","label":"Request a feature"}],"adapter_type":"snowflake","counts":{"metric":19,"model":15,"saved_query":3,"seed":6,"semantic_model":6,"source":6,"test":29,"unit_test":3},"dialect":"snowflake","erd_algo":"model_contract","generated_at":"2026-06-26 13:24:52","project_name":"jaffle_shop","repo_name":"datnguye/dbt-docs","repo_url":"https://github.com/datnguye/dbt-docs","show_about":true,"show_buy_me_a_coffee":true,"site_author":"Dat Nguyen","site_description":"A live dbdocs site built from the jaffle_shop dbt project","site_name":"dbdocs demo \u2014 jaffle_shop","site_url":"https://dbdocs.datnguye.me/latest/demo/latest/","versioned":true},"nodes":[{"$schema":"schema/node.schema.json","database":"shaman","description":"Product (food and drink items that can be ordered) data with basic cleaning and transformation applied, one row per product.","id":"model.jaffle_shop.stg_products","label":"stg_products","name":"stg_products","node_url":"nodes/model.jaffle_shop.stg_products.json","resource_type":"model","schema":"jf_staging"},{"$schema":"schema/node.schema.json","database":"shaman","description":"Customer data with basic cleaning and transformation applied, one row per customer.","id":"model.jaffle_shop.stg_customers","label":"stg_customers","name":"stg_customers","node_url":"nodes/model.jaffle_shop.stg_customers.json","resource_type":"model","schema":"jf_staging"},{"$schema":"schema/node.schema.json","database":"shaman","description":"List of our supply expenses data with basic cleaning and transformation applied.\nOne row per supply cost, not per supply. As supply costs fluctuate they receive a new row with a new UUID. Thus there can be multiple rows per supply_id.\n","id":"model.jaffle_shop.stg_supplies","label":"stg_supplies","name":"stg_supplies","node_url":"nodes/model.jaffle_shop.stg_supplies.json","resource_type":"model","schema":"jf_staging"},{"$schema":"schema/node.schema.json","database":"shaman","description":"Order data with basic cleaning and transformation applied, one row per order.","id":"model.jaffle_shop.stg_orders","label":"stg_orders","name":"stg_orders","node_url":"nodes/model.jaffle_shop.stg_orders.json","resource_type":"model","schema":"jf_staging"},{"$schema":"schema/node.schema.json","database":"shaman","description":"Individual food and drink items that make up our orders, one row per item.","id":"model.jaffle_shop.stg_order_items","label":"stg_order_items","name":"stg_order_items","node_url":"nodes/model.jaffle_shop.stg_order_items.json","resource_type":"model","schema":"jf_staging"},{"$schema":"schema/node.schema.json","database":"shaman","description":"List of open locations with basic cleaning and transformation applied, one row per location.","id":"model.jaffle_shop.stg_locations","label":"stg_locations","name":"stg_locations","node_url":"nodes/model.jaffle_shop.stg_locations.json","resource_type":"model","schema":"jf_staging"},{"$schema":"schema/node.schema.json","database":"shaman","description":"","id":"model.jaffle_shop.supplies","label":"supplies","name":"supplies","node_url":"nodes/model.jaffle_shop.supplies.json","resource_type":"model","schema":"jf_analytics"},{"$schema":"schema/node.schema.json","database":"shaman","description":"Customer dimension with segment classification. One row per customer per segment code (composite grain).","id":"model.jaffle_shop.dim_customer_segment","label":"dim_customer_segment","name":"dim_customer_segment","node_url":"nodes/model.jaffle_shop.dim_customer_segment.json","resource_type":"model","schema":"jf_analytics"},{"$schema":"schema/node.schema.json","database":"shaman","description":"","id":"model.jaffle_shop.products","label":"products","name":"products","node_url":"nodes/model.jaffle_shop.products.json","resource_type":"model","schema":"jf_analytics"},{"$schema":"schema/node.schema.json","database":"shaman","description":"Customer overview data mart, offering key details for each unique customer. One row per customer.","id":"model.jaffle_shop.customers","label":"customers","name":"customers","node_url":"nodes/model.jaffle_shop.customers.json","resource_type":"model","schema":"jf_analytics"},{"$schema":"schema/node.schema.json","database":"shaman","description":"Fact table joining orders to their customer segment at time of order. One row per order.","id":"model.jaffle_shop.fct_customer_segment_orders","label":"fct_customer_segment_orders","name":"fct_customer_segment_orders","node_url":"nodes/model.jaffle_shop.fct_customer_segment_orders.json","resource_type":"model","schema":"jf_analytics"},{"$schema":"schema/node.schema.json","database":"shaman","description":"Order overview data mart, offering key details for each order inlcluding if it's a customer's first order and a food vs. drink item breakdown. One row per order.","id":"model.jaffle_shop.orders","label":"orders","name":"orders","node_url":"nodes/model.jaffle_shop.orders.json","resource_type":"model","schema":"jf_analytics"},{"$schema":"schema/node.schema.json","database":"shaman","description":"Time spine table for MetricFlow, one row per day.","id":"model.jaffle_shop.metricflow_time_spine","label":"metricflow_time_spine","name":"metricflow_time_spine","node_url":"nodes/model.jaffle_shop.metricflow_time_spine.json","resource_type":"model","schema":"jf_analytics"},{"$schema":"schema/node.schema.json","database":"shaman","description":"","id":"model.jaffle_shop.order_items","label":"order_items","name":"order_items","node_url":"nodes/model.jaffle_shop.order_items.json","resource_type":"model","schema":"jf_analytics"},{"$schema":"schema/node.schema.json","database":"shaman","description":"Location overview data mart. One row per location.","id":"model.jaffle_shop.locations","label":"locations","name":"locations","node_url":"nodes/model.jaffle_shop.locations.json","resource_type":"model","schema":"jf_analytics"},{"$schema":"schema/node.schema.json","database":"shaman","description":"","id":"seed.jaffle_shop.raw_items","label":"raw_items","name":"raw_items","node_url":"nodes/seed.jaffle_shop.raw_items.json","resource_type":"seed","schema":"raw"},{"$schema":"schema/node.schema.json","database":"shaman","description":"","id":"seed.jaffle_shop.raw_customers","label":"raw_customers","name":"raw_customers","node_url":"nodes/seed.jaffle_shop.raw_customers.json","resource_type":"seed","schema":"raw"},{"$schema":"schema/node.schema.json","database":"shaman","description":"","id":"seed.jaffle_shop.raw_stores","label":"raw_stores","name":"raw_stores","node_url":"nodes/seed.jaffle_shop.raw_stores.json","resource_type":"seed","schema":"raw"},{"$schema":"schema/node.schema.json","database":"shaman","description":"","id":"seed.jaffle_shop.raw_orders","label":"raw_orders","name":"raw_orders","node_url":"nodes/seed.jaffle_shop.raw_orders.json","resource_type":"seed","schema":"raw"},{"$schema":"schema/node.schema.json","database":"shaman","description":"","id":"seed.jaffle_shop.raw_supplies","label":"raw_supplies","name":"raw_supplies","node_url":"nodes/seed.jaffle_shop.raw_supplies.json","resource_type":"seed","schema":"raw"},{"$schema":"schema/node.schema.json","database":"shaman","description":"","id":"seed.jaffle_shop.raw_products","label":"raw_products","name":"raw_products","node_url":"nodes/seed.jaffle_shop.raw_products.json","resource_type":"seed","schema":"raw"},{"$schema":"schema/node.schema.json","database":"shaman","description":"One record per person who has purchased one or more items","id":"source.jaffle_shop.ecom.raw_customers","label":"raw_customers","name":"raw_customers","node_url":"nodes/source.jaffle_shop.ecom.raw_customers.json","resource_type":"source","schema":"raw"},{"$schema":"schema/node.schema.json","database":"shaman","description":"One record per order (consisting of one or more order items)","id":"source.jaffle_shop.ecom.raw_orders","label":"raw_orders","name":"raw_orders","node_url":"nodes/source.jaffle_shop.ecom.raw_orders.json","resource_type":"source","schema":"raw"},{"$schema":"schema/node.schema.json","database":"shaman","description":"Items included in an order","id":"source.jaffle_shop.ecom.raw_items","label":"raw_items","name":"raw_items","node_url":"nodes/source.jaffle_shop.ecom.raw_items.json","resource_type":"source","schema":"raw"},{"$schema":"schema/node.schema.json","database":"shaman","description":"","id":"source.jaffle_shop.ecom.raw_stores","label":"raw_stores","name":"raw_stores","node_url":"nodes/source.jaffle_shop.ecom.raw_stores.json","resource_type":"source","schema":"raw"},{"$schema":"schema/node.schema.json","database":"shaman","description":"One record per SKU for items sold in stores","id":"source.jaffle_shop.ecom.raw_products","label":"raw_products","name":"raw_products","node_url":"nodes/source.jaffle_shop.ecom.raw_products.json","resource_type":"source","schema":"raw"},{"$schema":"schema/node.schema.json","database":"shaman","description":"One record per supply per SKU of items sold in stores","id":"source.jaffle_shop.ecom.raw_supplies","label":"raw_supplies","name":"raw_supplies","node_url":"nodes/source.jaffle_shop.ecom.raw_supplies.json","resource_type":"source","schema":"raw"},{"$schema":"schema/node.schema.json","database":"","description":"Customer's lifetime spend before tax","id":"metric.jaffle_shop.lifetime_spend_pretax","label":"lifetime_spend_pretax","name":"lifetime_spend_pretax","node_url":"nodes/metric.jaffle_shop.lifetime_spend_pretax.json","resource_type":"metric","schema":""},{"$schema":"schema/node.schema.json","database":"","description":"Count of lifetime orders","id":"metric.jaffle_shop.count_lifetime_orders","label":"count_lifetime_orders","name":"count_lifetime_orders","node_url":"nodes/met